{
  "behavior_expected": {
    "deferred_to": "WU3",
    "spec": "Replay the exact open-data candidate pool without selecting among same-label provider identities."
  },
  "bundle_closure": "closed",
  "case_id": "case_20000001-0000-4000-8000-000000000001",
  "case_version": "0.1.0",
  "coverage": [
    "exact eligible OSM response bytes",
    "every valid provider identity retained once",
    "matched, ambiguous, and unmatched seed accounting",
    "candidate-local provider facts",
    "CLOSED candidates-root offline replay"
  ],
  "dirty_cases": [
    {
      "dirty_case_id": "remove-provider-record-id",
      "expected_error": {
        "error_code": "SCHEMA_VALIDATION_ERROR",
        "json_pointer": "/payload/candidates/0/provider",
        "schema_rule": "required"
      },
      "json_pointer": "/payload/candidates/0/provider/record_id",
      "operation": "remove",
      "target_document": "candidates.json"
    }
  ],
  "documents": [
    {
      "content_utf8": "{\n  \"artifact_id\": \"urn:uuid:20000001-0000-4000-8000-000000000001\",\n  \"artifact_type\": \"request\",\n  \"created_at\": \"2026-07-28T08:40:51.708Z\",\n  \"integrity\": {\n    \"canonicalization\": \"canonical-json-v1\",\n    \"payload_sha256\": \"b49538aa6aea6526e4154e7aa18053ec343c3c5fa7a2436bdfb4f43143593823\"\n  },\n  \"payload\": {\n    \"explicit\": {\n      \"destination\": {\n        \"name\": \"婺源县\",\n        \"selection_mode\": \"fixed\"\n      },\n      \"origin\": {\n        \"kind\": \"user_input\",\n        \"value\": \"wu2r-resume-anchor:origin-unspecified\"\n      },\n      \"party\": {\n        \"count\": 1\n      },\n      \"preferences_raw\": [\n        \"WU2R真实开放数据锚点；不代表推荐、路线或可行行程。\"\n      ],\n      \"transport_modes\": [\n        \"walking\"\n      ],\n      \"travel_window\": {\n        \"end\": \"2026-08-05T20:00:00+08:00\",\n        \"start\": \"2026-08-05T08:00:00+08:00\",\n        \"timezone\": \"Asia/Shanghai\"\n      }\n    },\n    \"natural_language\": \"固定婺源县作为开放数据锚点范围；仅回放候选池，不执行推荐或规划。\",\n    \"request_id\": \"request_20000001-0000-4000-8000-000000000001\",\n    \"user_input_refs\": [\n      {\n        \"kind\": \"user_input\",\n        \"value\": \"wu2r-resume-anchor:request\"\n      }\n    ]\n  },\n  \"producer\": {\n    \"name\": \"trip-decider-wu2r-resume-fixture\",\n    \"run_id\": \"run_20000001-0000-4000-8000-000000000001\",\n    \"version\": \"0.1.0\"\n  },\n  \"provenance\": {\n    \"input_hashes\": [\n      {\n        \"name\": \"approved-resume-plan\",\n        \"sha256\": \"aae5da96f11c367e450522cbafdd1a7648ad527b42fbfc642c0fcdf355699674\"\n      }\n    ],\n    \"parent_artifact_ids\": [],\n    \"pipeline_stage\": \"wu2r-resume-fixture-request\"\n  },\n  \"schema_version\": \"0.1.0\"\n}\n",
      "expected_schema_id": "https://trip-decider.example/schemas/0.1.0/request.schema.json",
      "file_sha256": "a09999316e2f4a7c52627d6f212fde628d12a4c6ac381fcfc479f2d301b8cd23",
      "media_type": "application/json",
      "relative_path": "request.json"
    },
    {
      "content_utf8": "{\n  \"artifact_id\": \"urn:uuid:13056a6a-7fb7-436a-9d55-6002d1981903\",\n  \"artifact_type\": \"candidates\",\n  \"created_at\": \"2026-07-28T08:40:51.708Z\",\n  \"integrity\": {\n    \"canonicalization\": \"canonical-json-v1\",\n    \"payload_sha256\": \"1935798b8947b618ccc0342fb7236ab2a264c14d27c4da058a8d7bd4fff6d161\"\n  },\n  \"payload\": {\n    \"candidate_set_id\": \"candidate_set_3d2b5476-df88-40b5-a61a-e8c6e697ac92\",\n    \"candidates\": [\n      {\n        \"candidate_id\": \"candidate_70ae7fa8-a52c-4b66-a869-d30fbf60a97d\",\n        \"candidate_kind\": \"poi\",\n        \"evidence_fact_refs\": [],\n        \"generation_reason\": \"Imported from an OSM open-data anchor; no ranking performed.\",\n        \"label\": \"婺源县\",\n        \"location\": {\n          \"crs\": \"WGS84\",\n          \"kind\": \"coordinates\",\n          \"latitude\": 29.323384,\n          \"longitude\": 117.7542738,\n          \"source_refs\": [\n            {\n              \"kind\": \"provider_item\",\n              \"value\": \"osm:node:244082160\"\n            }\n          ]\n        },\n        \"parent_candidate_id\": null,\n        \"provider\": {\n          \"categories\": [\n            {\n              \"code\": \"place=county\",\n              \"label\": \"county\"\n            }\n          ],\n          \"data_policy\": {\n            \"authorization_ref\": null,\n            \"capture_mode\": \"persistent_anchor\",\n            \"fixture_allowed\": true,\n            \"license\": {\n              \"attribution\": \"© OpenStreetMap contributors\",\n              \"identifier\": \"ODbL-1.0\",\n              \"url\": \"https://opendatacommons.org/licenses/odbl/1-0/\"\n            },\n            \"policy_checked_at\": \"2026-07-28T00:00:00+08:00\",\n            \"replay_allowed\": true,\n            \"source_class\": \"open_data\",\n            \"storage_policy\": \"persistent_allowed\",\n            \"terms_url\": \"https://www.openstreetmap.org/copyright\"\n          },\n          \"external_status\": {\n            \"kind\": \"not_reported\"\n          },\n          \"name\": \"osm\",\n          \"record_id\": \"244082160\",\n          \"record_type\": \"node\"\n        },\n        \"source_refs\": [\n          {\n            \"kind\": \"provider_item\",\n            \"value\": \"osm:node:244082160\"\n          }\n        ]\n      },\n      {\n        \"candidate_id\": \"candidate_a0197ec2-70dc-45ba-ad68-c7f80abfc018\",\n        \"candidate_kind\": \"poi\",\n        \"evidence_fact_refs\": [],\n        \"generation_reason\": \"Imported from an OSM open-data anchor; no ranking performed.\",\n        \"label\": \"婺源县\",\n        \"location\": {\n          \"crs\": \"WGS84\",\n          \"kind\": \"coordinates\",\n          \"latitude\": 29.2506588,\n          \"longitude\": 117.8558318,\n          \"source_refs\": [\n            {\n              \"kind\": \"provider_item\",\n              \"value\": \"osm:node:673351120\"\n            }\n          ]\n        },\n        \"parent_candidate_id\": null,\n        \"provider\": {\n          \"categories\": [\n            {\n              \"code\": \"place=city\",\n              \"label\": \"city\"\n            }\n          ],\n          \"data_policy\": {\n            \"authorization_ref\": null,\n            \"capture_mode\": \"persistent_anchor\",\n            \"fixture_allowed\": true,\n            \"license\": {\n              \"attribution\": \"© OpenStreetMap contributors\",\n              \"identifier\": \"ODbL-1.0\",\n              \"url\": \"https://opendatacommons.org/licenses/odbl/1-0/\"\n            },\n            \"policy_checked_at\": \"2026-07-28T00:00:00+08:00\",\n            \"replay_allowed\": true,\n            \"source_class\": \"open_data\",\n            \"storage_policy\": \"persistent_allowed\",\n            \"terms_url\": \"https://www.openstreetmap.org/copyright\"\n          },\n          \"external_status\": {\n            \"kind\": \"not_reported\"\n          },\n          \"name\": \"osm\",\n          \"record_id\": \"673351120\",\n          \"record_type\": \"node\"\n        },\n        \"source_refs\": [\n          {\n            \"kind\": \"provider_item\",\n            \"value\": \"osm:node:673351120\"\n          }\n        ]\n      },\n      {\n        \"candidate_id\": \"candidate_31943b34-149b-46c1-a53f-50abde1d000d\",\n        \"candidate_kind\": \"poi\",\n        \"evidence_fact_refs\": [],\n        \"generation_reason\": \"Imported from an OSM open-data anchor; no ranking performed.\",\n        \"label\": \"篁岭\",\n        \"location\": {\n          \"crs\": \"WGS84\",\n          \"kind\": \"coordinates\",\n          \"latitude\": 29.3235898,\n          \"longitude\": 118.1132609,\n          \"source_refs\": [\n            {\n              \"kind\": \"provider_item\",\n              \"value\": \"osm:node:4818081345\"\n            }\n          ]\n        },\n        \"parent_candidate_id\": null,\n        \"provider\": {\n          \"categories\": [\n            {\n              \"code\": \"place=hamlet\",\n              \"label\": \"hamlet\"\n            }\n          ],\n          \"data_policy\": {\n            \"authorization_ref\": null,\n            \"capture_mode\": \"persistent_anchor\",\n            \"fixture_allowed\": true,\n            \"license\": {\n              \"attribution\": \"© OpenStreetMap contributors\",\n              \"identifier\": \"ODbL-1.0\",\n              \"url\": \"https://opendatacommons.org/licenses/odbl/1-0/\"\n            },\n            \"policy_checked_at\": \"2026-07-28T00:00:00+08:00\",\n            \"replay_allowed\": true,\n            \"source_class\": \"open_data\",\n            \"storage_policy\": \"persistent_allowed\",\n            \"terms_url\": \"https://www.openstreetmap.org/copyright\"\n          },\n          \"external_status\": {\n            \"kind\": \"not_reported\"\n          },\n          \"name\": \"osm\",\n          \"record_id\": \"4818081345\",\n          \"record_type\": \"node\"\n        },\n        \"source_refs\": [\n          {\n            \"kind\": \"provider_item\",\n            \"value\": \"osm:node:4818081345\"\n          }\n        ]\n      },\n      {\n        \"candidate_id\": \"candidate_cf7475fc-463a-48cd-a0e9-8c8726ee3f2c\",\n        \"candidate_kind\": \"poi\",\n        \"evidence_fact_refs\": [],\n        \"generation_reason\": \"Imported from an OSM open-data anchor; no ranking performed.\",\n        \"label\": \"李坑\",\n        \"location\": {\n          \"crs\": \"WGS84\",\n          \"kind\": \"coordinates\",\n          \"latitude\": 29.3256496,\n          \"longitude\": 117.9266239,\n          \"source_refs\": [\n            {\n              \"kind\": \"provider_item\",\n              \"value\": \"osm:node:5136917928\"\n            }\n          ]\n        },\n        \"parent_candidate_id\": null,\n        \"provider\": {\n          \"categories\": [\n